{
    "$schema": "http://json-schema.org/draft-07/schema#",
    "title": "Course information",
    "description": "The specification file for a course.",
    "type": "object",
    "additionalProperties": false,
    "required": [
        "uuid",
        "name",
        "title",
        "topics"
    ],
    "properties": {
        "comment": {
            "description": "Arbitrary comment for reference purposes.",
            "anyOf": [{"type": "string"}, {"type": "array"}, {"type": "object"}]
        },
        "uuid": {
            "description": "Unique identifier (UUID v4).",
            "type": "string",
            "pattern": "^[0-9a-fA-F]{8}-[0-9a-fA-F]{4}-[0-9a-fA-F]{4}-[0-9a-fA-F]{4}-[0-9a-fA-F]{12}$"
        },
        "name": {
            "description": "The course name (e.g., 'TAM 212').",
            "type": "string"
        },
        "title": {
            "description": "The course title (e.g., 'Introductory Dynamics').",
            "type": "string"
        },
        "timezone": {
            "description": "The timezone for all date input and display (e.g., \"America/Chicago\", from the TZ column at https://en.wikipedia.org/wiki/List_of_tz_database_time_zones).",
            "type": "string",
            "default": "America/Chicago"
        },
        "options": {
            "description": "Options for this course.",
            "type": "object",
            "additionalProperties": false,
            "properties": {
                "comment": {
                    "description": "Arbitrary comment for reference purposes.",
                    "anyOf": [{"type": "string"}, {"type": "array"}, {"type": "object"}]
                },
                "useNewQuestionRenderer": {
                    "description": "Feature flag to enable the new question renderer.",
                    "type": "boolean",
                    "default": false
                }
            }
        },
        "assessmentSets": {
            "description": "Assessment sets.",
            "type": "array",
            "items": {
                "description": "A single assessment set description.",
                "type": "object",
                "required": [
                    "abbreviation",
                    "name",
                    "heading",
                    "color"
                ],
                "properties": {
                    "comment": {
                        "description": "Arbitrary comment for reference purposes.",
                        "anyOf": [{"type": "string"}, {"type": "array"}, {"type": "object"}]
                    },
                    "abbreviation": {
                        "description": "Abbreviation (preferably 1 to 3 characters), e.g., 'HW', 'Q', 'PQ', etc.",
                        "type": "string"
                    },
                    "name": {
                        "description": "Full singular name (preferably 1 to 3 words), e.g., 'Homework', 'Quiz', 'Practice Quiz'.",
                        "type": "string"
                    },
                    "heading": {
                        "description": "Plural heading for a group of assessments (preferably 1 to 3 words), e.g., 'Homeworks', 'Quizzes'.",
                        "type": "string"
                    },
                    "color": {
                        "$ref": "#/definitions/color"
                    }
                }
            }
        },
        "topics": {
            "description": "Question topics (visible to students).",
            "type": "array",
            "items": {
                "description": "A single assessment set description.",
                "type": "object",
                "required": [
                    "name",
                    "color"
                ],
                "properties": {
                    "comment": {
                        "description": "Arbitrary comment for reference purposes.",
                        "anyOf": [{"type": "string"}, {"type": "array"}, {"type": "object"}]
                    },
                    "shortName": {
                        "description": "Short name (preferably 2 to 7 characters).",
                        "type": "string"
                    },
                    "name": {
                        "description": "Long descriptive name (preferably less than 10 words).",
                        "type": "string"
                    },
                    "color": {
                        "$ref": "#/definitions/color"
                    },
                    "description": {
                        "description": "Description of the topic.",
                        "type": "string"
                    }
                }
            }
        },
        "tags": {
            "description": "Question tags (not visible to students).",
            "type": "array",
            "items": {
                "description": "A single tag description.",
                "type": "object",
                "required": [
                    "name",
                    "color"
                ],
                "properties": {
                    "comment": {
                        "description": "Arbitrary comment for reference purposes.",
                        "anyOf": [{"type": "string"}, {"type": "array"}, {"type": "object"}]
                    },
                    "shortName": {
                        "description": "Short name (preferably 2 to 7 characters).",
                        "type": "string"
                    },
                    "name": {
                        "description": "Long descriptive name (preferably less than 10 words).",
                        "type": "string"
                    },
                    "color": {
                        "$ref": "#/definitions/color"
                    },
                    "description": {
                        "description": "Description of the tag.",
                        "type": "string"
                    }
                }
            }
        }
    },
    "definitions": {
        "color": {
            "description": "A color name.",
            "enum": [
                "red1",
                "red2",
                "red3",
                "pink1",
                "pink2",
                "pink3",
                "purple1",
                "purple2",
                "purple3",
                "blue1",
                "blue2",
                "blue3",
                "turquoise1",
                "turquoise2",
                "turquoise3",
                "green1",
                "green2",
                "green3",
                "yellow1",
                "yellow2",
                "yellow3",
                "orange1",
                "orange2",
                "orange3",
                "brown1",
                "brown2",
                "brown3",
                "gray1",
                "gray2",
                "gray3"
            ]
        }
    }
}
