{
  "uuid": "b7198b89-2dcd-405c-99c9-1df4aa9eaeec",
  "name": "TPL 101",
  "title": "Template Course",
  "options": {
    "useNewQuestionRenderer": true
  },
  "assessmentSets": [
    {
      "abbreviation": "HW",
      "name": "Homework",
      "heading": "Homeworks",
      "color": "green1"
    },
    {
      "abbreviation": "Q",
      "name": "Quiz",
      "heading": "Quizzes",
      "color": "red1"
    },
    {
      "abbreviation": "PQ",
      "name": "Practice Quiz",
      "heading": "Practice Quizzes",
      "color": "pink1"
    },
    {
      "abbreviation": "E",
      "name": "Exam",
      "heading": "Exams",
      "color": "brown1"
    },
    {
      "abbreviation": "PE",
      "name": "Practice Exam",
      "heading": "Practice Exams",
      "color": "yellow1"
    },
    {
      "abbreviation": "WS",
      "name": "Worksheet",
      "heading": "Worksheets",
      "color": "purple1"
    },
    {
      "abbreviation": "U",
      "name": "Unknown",
      "heading": "Unknown",
      "color": "red3"
    }
  ],
  "topics": [],
  "tags": [
    {
      "name": "numeric",
      "color": "brown1",
      "description": "The answer format is one or more numerical values."
    },
    {
      "name": "symbolic",
      "color": "blue1",
      "description": "The answer format is a symbolic expression."
    },
    {
      "name": "drawing",
      "color": "yellow1",
      "description": "The answer format requires drawing on a canvas to input a graphical representation of an answer."
    },
    {
      "name": "MC",
      "color": "green1",
      "description": "The answer format is choosing from a small finite set of answers."
    },
    {
      "name": "code",
      "color": "turquoise1",
      "description": "The answer format is a piece of code."
    },
    {
      "name": "multianswer",
      "color": "orange2",
      "description": "The question requires multiple answers, either as steps in a sequence or as separate questions."
    },
    {
      "name": "graph",
      "color": "purple1",
      "description": "The question tests reading information from a graph or drawing a graph."
    },
    {
      "name": "concept",
      "color": "pink1",
      "description": "The question tests conceptual understanding of a topic."
    },
    {
      "name": "calculate",
      "color": "green2",
      "description": "The questions tests performing a numerical calculation, with either a calculator or equivalent software."
    },
    {
      "name": "secret",
      "color": "red3",
      "description": "Only use this question on exams or quizzes that won't be released to students, so the question can be kept secret."
    },
    {
      "name": "nontest",
      "color": "green3",
      "description": "This question is not appropriate for use in a restricted testing environment, so only use it on homeworks or similar."
    }
  ]
}
